<?xml version="1.0" ?>

<serializer xmlns="http://symfony.com/schema/dic/serializer-mapping"
                    xmlns:xsi="http://www.w3.org/2001/XMLSchema-instance"
                    xsi:schemaLocation="http://symfony.com/schema/dic/serializer-mapping https://symfony.com/schema/dic/serializer-mapping/serializer-mapping-1.0.xsd">

    <class name="Symfony\Component\Serializer\Tests\Fixtures\Attributes\GroupDummy">
        <attribute name="foo">
            <group>group1</group>
            <group>group2</group>
        </attribute>

        <attribute name="bar">
            <group>group2</group>
        </attribute>
    </class>

    <class name="Symfony\Component\Serializer\Tests\Fixtures\Attributes\MaxDepthDummy">
        <attribute name="foo" max-depth="2" />
        <attribute name="bar" max-depth="3" />
    </class>

    <class name="Symfony\Component\Serializer\Tests\Fixtures\Attributes\SerializedNameDummy">
        <attribute name="foo" serialized-name="baz" />
        <attribute name="bar" serialized-name="qux" />
        <attribute name="duux">
            <serialized name="duxi" />
            <serialized name="duxa">
                <group>a</group>
            </serialized>
        </attribute>
    </class>

    <class name="Symfony\Component\Serializer\Tests\Fixtures\Attributes\SerializedPathDummy">
        <attribute name="three" serialized-path="[one][two]" />
        <attribute name="seven" serialized-path="[three][four]" />
        <attribute name="eleven">
            <serialized path="[five][six]" />
            <serialized path="[six][five]">
                <group>a</group>
            </serialized>
        </attribute>
    </class>

    <class name="Symfony\Component\Serializer\Tests\Fixtures\Attributes\SerializedPathInConstructorDummy">
        <attribute name="three" serialized-path="[one][two]" />
        <attribute name="eleven" serialized-path="[five][six]">
            <serialized path="[six][five]">
                <group>a</group>
            </serialized>
        </attribute>
    </class>

    <class name="Symfony\Component\Serializer\Tests\Fixtures\Attributes\AbstractDummy">
        <discriminator-map type-property="type" default-type="second">
            <mapping type="first" class="Symfony\Component\Serializer\Tests\Fixtures\Attributes\AbstractDummyFirstChild" />
            <mapping type="second" class="Symfony\Component\Serializer\Tests\Fixtures\Attributes\AbstractDummySecondChild" />
        </discriminator-map>

        <attribute name="foo" />
    </class>

    <class name="Symfony\Component\Serializer\Tests\Fixtures\Attributes\IgnoreDummy">
        <attribute name="ignored1" ignore="true" />
        <attribute name="ignored2" ignore="true" />
        <attribute name="notIgnored" ignore="false" />
    </class>

    <class name="Symfony\Component\Serializer\Tests\Fixtures\Attributes\ContextDummyParent">
        <attribute name="parentProperty">
            <normalization_context>
                <entry name="prop">dummy_parent_value</entry>
            </normalization_context>
        </attribute>
        <attribute name="overriddenParentProperty">
            <normalization_context>
                <entry name="prop">dummy_parent_value</entry>
            </normalization_context>
        </attribute>
    </class>

    <class name="Symfony\Component\Serializer\Tests\Fixtures\Attributes\ContextDummy">
        <attribute name="foo">
            <context>
                <entry name="foo">value</entry>
                <entry name="bar">value</entry>
                <entry name="nested">
                    <entry name="nested_key">nested_value</entry>
                </entry>
                <entry name="array">
                    <entry>first</entry>
                    <entry>second</entry>
                </entry>
            </context>
            <context>
                <group>a</group>
                <entry name="bar">value_for_group_a</entry>
            </context>
        </attribute>
        <attribute name="bar">
            <normalization_context>
                <group>a</group>
                <group>b</group>
                <entry name="format">d/m/Y</entry>
            </normalization_context>
            <denormalization_context>
                <group>a</group>
                <group>b</group>
                <entry name="format">m-d-Y H:i</entry>
            </denormalization_context>
        </attribute>
        <attribute name="overriddenParentProperty">
            <normalization_context>
                <entry name="prop">dummy_value</entry>
            </normalization_context>
        </attribute>
        <attribute name="methodWithContext">
            <context>
                <entry name="method">method_with_context</entry>
            </context>
        </attribute>
    </class>

    <class name="Symfony\Component\Serializer\Tests\Fixtures\Attributes\MaxDepthZeroDummy">
        <attribute name="child" max-depth="0" />
    </class>
</serializer>
